{
  "latex": "x**2 - 5*x + 6 = 0",
  "solution": [
    "x = 2",
    "x = 3"
  ],
  "steps": [
    {
      "index": 1,
      "latex_before": "x**2 - 5*x + 6 = 0",
      "latex_after": "(x - 3)*(x - 2) = 0",
      "rule": "factorizaci\u00f3n",
      "narration": "Factorizamos el trinomio en dos binomios."
    },
    {
      "index": 2,
      "latex_before": "(x - 3)*(x - 2) = 0",
      "latex_after": "x=2 o x=3",
      "rule": "propiedad del producto nulo",
      "narration": "Si un producto es cero, uno de los factores debe anularse."
    },
    {
      "index": 3,
      "latex_before": "x=2 o x=3",
      "latex_after": "x = 2, x = 3",
      "rule": "aislar la variable",
      "narration": "Resolvemos cada ecuaci\u00f3n lineal para encontrar los valores de la inc\u00f3gnita."
    }
  ],
  "manim_code": "\nfrom manim import *\n\nclass SolutionScene(Scene):\n    def construct(self):\n        title = Tex(r\"Problema: x**2 - 5*x + 6 = 0\")\n        self.play(Write(title))\n        self.wait(1)\n\n        \n        # Paso 1\n        step_1 = Tex(r\"Paso 1: (x - 3)*(x - 2) = 0\")\n        rule_1 = Tex(r\"Regla: factorizaci\u00f3n\")\n        narr_1 = Tex(r\"Factorizamos el trinomio en dos binomios.\")\n        \n\n        # Paso 2\n        step_2 = Tex(r\"Paso 2: x=2 o x=3\")\n        rule_2 = Tex(r\"Regla: propiedad del producto nulo\")\n        narr_2 = Tex(r\"Si un producto es cero, uno de los factores debe anularse.\")\n        \n\n        # Paso 3\n        step_3 = Tex(r\"Paso 3: x = 2, x = 3\")\n        rule_3 = Tex(r\"Regla: aislar la variable\")\n        narr_3 = Tex(r\"Resolvemos cada ecuaci\u00f3n lineal para encontrar los valores de la inc\u00f3gnita.\")\n        \n\n        self.play(FadeOut(title))\n\n        \n        self.play(Write(step_1))\n        self.play(Write(rule_1))\n        self.play(Write(narr_1))\n        self.wait(1)\n        self.play(FadeOut(step_1, rule_1, narr_1))\n        \n\n        self.play(Write(step_2))\n        self.play(Write(rule_2))\n        self.play(Write(narr_2))\n        self.wait(1)\n        self.play(FadeOut(step_2, rule_2, narr_2))\n        \n\n        self.play(Write(step_3))\n        self.play(Write(rule_3))\n        self.play(Write(narr_3))\n        self.wait(1)\n        self.play(FadeOut(step_3, rule_3, narr_3))\n        \n\n        final_tex = Tex(r\"Soluci\u00f3n: x = 2 , x = 3\")\n        self.play(Write(final_tex))\n        self.wait(2)\n"
}